title,url,description,author,scraped_at,source
"The Weird, Twisting Tale of How China Spied on Alysa Liu and Her Dad",https://www.wired.com/story/the-weird-twisting-tale-of-how-china-spied-on-alysa-liu-and-her-dad/,"Years before the figure skater became an Olympic superstar, a Chinese operative tried to stalk her father and monitored other US residents deemed dissidents against China. And that’s just the beginning.",TIMOTHY MCLAUGHLIN,2026-04-21T08:49:44.042778,Wired.com
Security News This Week: It Takes 2 Minutes to Hack the EU-s New Age-Verification App,https://www.wired.com/story/security-news-this-week-it-takes-2-minutes-to-hack-the-eus-new-age-verification-app/,"Plus: Major data breaches at a gym chain and hotel giant, a disruptive DDoS attack against Bluesky, dubious ICE hires, and more.",DELL CAMERON,2026-04-21T08:49:45.297332,Wired.com
Republican Mutiny Sinks Trump's Push to Extend Warrantless Surveillance,https://www.wired.com/story/republican-mutiny-sinks-trumps-push-to-extend-warrantless-surveillance/,"A post-midnight revolt in the House sank the White House's efforts to extend Section 702—a spy program the FBI has used to look into members of Congress, protesters, and political donors.",DELL CAMERON,2026-04-21T08:49:46.473144,Wired.com
The Dumbest Hack of the Year Exposed a Very Real Problem,https://www.wired.com/story/crosswalk-city-hack-cybersecurity-lessons/,"Last April, a hacker hijacked crosswalk announcements to mimic Mark Zuckerberg and Elon Musk. Records obtained by WIRED reveal how unprepared local authorities were.",PARESH DAVE,2026-04-21T08:49:47.697193,Wired.com
Security News This Week: Your Push Notifications Aren’t Safe From the FBI,https://www.wired.com/story/security-news-this-week-your-push-notifications-arent-safe-from-the-fbi/,"Plus: Iran’s internet blackout hits the 1,000-hour mark, cryptocurrency scams result in a record amount of money stolen from Americans, and more.",MATT BURGESS,2026-04-21T08:49:48.906289,Wired.com
Anthropic’s Mythos Will Force a Cybersecurity Reckoning—Just Not the One You Think,https://www.wired.com/story/anthropics-mythos-will-force-a-cybersecurity-reckoning-just-not-the-one-you-think/,The new AI model is being heralded—and feared—as a hacker’s superweapon. Experts say its arrival is a wake-up call for developers who have long made security an afterthought.,LILY HAY NEWMAN,2026-04-21T08:49:50.106244,Wired.com
Politicians Are Spending More Money on Security as They Increasingly Become Targets,https://www.wired.com/story/political-campaign-security-spending/,"Political candidates are purchasing more home alarms, bulletproof vests, and other protections amid rising fears of political violence.",MADDY VARNER,2026-04-21T08:49:51.289049,Wired.com
The Shocking Secrets of Madison Square Garden’s Surveillance Machine,https://www.wired.com/story/madison-square-garden-jim-dolan-surveillance-machine/,"Famously vengeful Knicks owner Jim Dolan has long spied on people at his iconic arenas. WIRED goes deep inside the operation that allegedly tracked a trans woman, lawyers, protesters, and more.",NOAH SHACHTMAN,2026-04-21T08:49:52.531665,Wired.com
Europe’s Online Age Verification App Is Here,https://www.wired.com/story/europes-online-age-verification-app-is-here/,"Available for free to any company that wants to use it, the “completely anonymous” app puts the pressure on porn sites and social media platforms to start blocking access by minors.",VALENTINA NERI,2026-04-21T08:49:53.715261,Wired.com
Meta Is Warned That Facial Recognition Glasses Will Arm Sexual Predators,https://www.wired.com/story/meta-ray-ban-oakley-smart-glasses-no-face-recognition-civil-society/,"More than 70 organizations, including the ACLU, EPIC, and Fight for the Future, say the AI smart glasses feature would endanger abuse victims, immigrants, and LGBTQ+ people.",DELL CAMERON,2026-04-21T08:49:54.928521,Wired.com
Security News This Week: Hackers Are Posting the Claude Code Leak With Bonus Malware,https://www.wired.com/story/security-news-this-week-hackers-are-posting-the-claude-code-leak-with-bonus-malware/,"Plus: The FBI says a recent hack of its wiretap tools poses a national security risk, attackers stole Cisco source code as part of an ongoing supply chain hacking spree, and more.",ANDY GREENBERG,2026-04-21T08:49:56.389569,Wired.com
How the Internet Broke Everyone’s Bullshit Detectors,https://www.wired.com/story/how-the-internet-broke-everyones-bullshit-detectors/,"From AI-generated images to restricted satellite data, the systems used to verify what’s real online are struggling to keep up.",GIA CHAUDRY,2026-04-21T08:49:57.573659,Wired.com
How to Organize Safely in the Age of Surveillance,https://www.wired.com/story/how-to-organize-safely-in-the-age-of-surveillance/,"From threat modeling to encrypted collaboration apps, we’ve collected experts’ tips and tools for safely and effectively building a group—even while being targeted and tracked by the powerful.",ANDY GREENBERG,2026-04-21T08:49:58.751584,Wired.com
How to Protest Safely in the Age of Surveillance,https://www.wired.com/story/how-to-protest-safely-surveillance-digital-privacy/,Law enforcement has more tools than ever to track your movements and access your communications. Here’s how to protect your privacy if you plan to protest.,ANDY GREENBERG,2026-04-21T08:49:59.964849,Wired.com
8 WhatsApp Features to Boost Your Security and Privacy,https://www.wired.com/story/5-features-that-boost-security-and-privacy-on-whatsapp/,Meta’s end-to-end encrypted messaging app is used by billions of people. Here’s how to make sure you’re one of the most locked-down ones out there.,KATE O'FLAHERTY,2026-04-21T08:50:01.299455,Wired.com
The Deepfake Nudes Crisis in Schools Is Much Worse Than You Thought,https://www.wired.com/story/deepfake-nudify-schools-global-crisis/,An analysis by WIRED and Indicator found nearly 90 schools and 600 students around the world impacted by AI-generated deepfake nude images—and the problem shows no signs of going away.,MATT BURGESS,2026-04-21T08:50:02.744517,Wired.com
Telegram Is Still Hosting a Sanctioned $21 Billion Crypto Scammer Black Market,https://www.wired.com/story/telegram-is-still-hosting-a-sanctioned-21-billion-crypto-scammer-black-market/,The UK designated Xinbi Guarantee as an enabler of crypto scammers and human trafficking weeks ago. Telegram is still hosting it in plain sight.,ANDY GREENBERG,2026-04-21T08:50:03.967177,Wired.com
The FCC Has a Fast Lane for Complaints About Trump’s Media Critics,https://www.wired.com/story/the-fcc-has-a-fast-lane-for-complaints-about-trumps-media-critics/,Internal emails obtained by WIRED reveal how a conservative legal group with a direct line into FCC chairman Brendan Carr’s office built the case against Jimmy Kimmel and his employees.,DELL CAMERON,2026-04-21T08:50:05.241126,Wired.com
Men Are Buying Hacking Tools to Use Against Their Wives and Friends,https://www.wired.com/story/men-are-buying-hacking-tools-to-use-against-their-wives-and-friends/,"In Telegram groups, men are sharing thousands of nonconsensual images of women and girls, buying spyware, and engaging in doxing and sexual abuse.",MATT BURGESS,2026-04-21T08:50:06.750764,Wired.com
"In the Wake of Anthropic’s Mythos, OpenAI Has a New Cybersecurity Model—and Strategy",https://www.wired.com/story/in-the-wake-of-anthropics-mythos-openai-has-a-new-cybersecurity-model-and-strategy/,"OpenAI says its safeguards “sufficiently reduce cyber risk” for now, while GPT-5.4-Cyber is a new cybersecurity-focused model.",LILY HAY NEWMAN,2026-04-21T08:50:07.965681,Wired.com
‘We Were Not Ready for This’: Lebanon's Emergency System Is Hanging by a Thread,https://www.wired.com/story/we-were-not-ready-for-this-lebanons-emergency-system-is-hanging-by-a-thread/,"In Lebanon, nearly 1 in 5 people has been displaced by Israeli attacks, leaving the government to manage a modern crisis without modern digital infrastructure.",CARLA SERTIN,2026-04-21T08:50:09.419779,Wired.com
Iran-Linked Hackers Are Sabotaging US Energy and Water Infrastructure,https://www.wired.com/story/iran-linked-hackers-are-sabotaging-us-energy-and-water-infrastructure/,"As Trump threatens Iranian infrastructure, the US government warns that Iran has carried out its own digital attacks against US critical infrastructure.",ANDY GREENBERG,2026-04-21T08:50:10.620125,Wired.com
Anthropic Teams Up With Its Rivals to Keep AI From Hacking Everything,https://www.wired.com/story/anthropic-mythos-preview-project-glasswing/,"The AI lab's Project Glasswing will bring together Apple, Google, and more than 45 other organizations. They'll use the new Claude Mythos Preview model to test advancing AI cybersecurity capabilities.",LILY HAY NEWMAN,2026-04-21T08:50:12.074339,Wired.com
Border Patrol Agents Sold Challenge Coins With Charlotte’s Web Characters in Riot Gear,https://www.wired.com/story/us-border-patrol-challenge-coins-nonprofits/,"Nonprofits run out of US Border Patrol stations are also selling other “operation”-themed coins that include a phrase popularized by the Proud Boys, potentially in violation of government rules.",MADDY VARNER,2026-04-21T08:50:13.103276,Wired.com
The Hack That Exposed Syria’s Sweeping Security Failures,https://www.wired.com/story/inside-the-hack-that-exposed-syrias-security-failures/,"When Syrian government accounts were hijacked in March, the breach looked chaotic. But it revealed something more troubling: a state struggling with the most basic layer of cybersecurity.",DANNY MAKKI,2026-04-21T08:50:14.101480,Wired.com
Meta Pauses Work With Mercor After Data Breach Puts AI Industry Secrets at Risk,https://www.wired.com/story/meta-pauses-work-with-mercor-after-data-breach-puts-ai-industry-secrets-at-risk/,"Major AI labs are investigating a security incident that impacted Mercor, a leading data vendor. The incident could have exposed key data about how they train AI models.",MAXWELL ZEFF,2026-04-21T08:50:15.088583,Wired.com
CBP Facility Codes Sure Seem to Have Leaked Via Online Flashcards,https://www.wired.com/story/cbp-facility-codes-sure-seem-to-have-leaked-via-online-flashcards/,"The Quizlet flashcards, which WIRED found through basic Google searches, seem to include sensitive information about gate security at Customs and Border Protection locations.",SAMMY SUSSMAN,2026-04-21T08:50:16.639481,Wired.com
"Uncanny Valley: Iran’s Threats on US Tech, Trump’s Plans for Midterms, and Polymarket’s Pop-up Flop",https://www.wired.com/story/uncanny-valley-podcast-iran-targets-us-tech-polymarket-pop-up-trump-midterms/,"In this episode, we discuss Iran’s threats to target US tech firms, gear up for the midterm elections, and get a scene report from the Polymarket pop-up bar in DC.",BRIAN BARRETT,2026-04-21T08:50:17.822989,Wired.com
What Happens When a Nuclear Site Is Hit?,https://www.wired.com/story/heres-what-can-happen-when-the-us-bombs-irans-nuclear-sites/,"As strikes continue on Iran’s nuclear facilities, the real danger isn’t the explosion, but what happens if critical safety systems fail—and how that risk could spread across the Gulf.",JETHU ABRAHAM,2026-04-21T08:50:19.093247,Wired.com
Unmasking the Paramilitary Agents Behind Trump’s Violent Immigration Crackdown,https://www.wired.com/story/border-patrol-bortac-borstar-use-of-force-midway-blitz/,A WIRED analysis of DHS records identified dozens of specialized federal agents who used force against US civilians during the largest known deployment of its kind in US history.,ALI WINSTON,2026-04-21T08:50:20.539927,Wired.com
Apple Will Push Out Rare ‘Backported’ Patches to Protect iOS 18 Users From DarkSword Hacking Tool,https://www.wired.com/story/apple-will-push-out-rare-backported-patches-to-protect-ios-18-users-from-darksword-hacking-tool/,"As DarkSword spreads, Apple tells WIRED it will enable iOS 18-specific fixes for millions of iPhone owners who remain on that iOS version rather than force them to update to iOS 26.",ANDY GREENBERG,2026-04-21T08:50:21.849453,Wired.com
Iran Threatens to Start Attacking Major US Tech Firms on April 1,https://www.wired.com/story/iran-threatens-to-start-attacking-major-us-tech-firms-on-april-1/,"Tech giants like Apple, Google, and Microsoft are among those on a target list released by Iran’s Islamic Revolutionary Guard Corps.",DELL CAMERON,2026-04-21T08:50:23.341733,Wired.com
The US Military’s GPS Software Is an $8 Billion Mess,https://www.wired.com/story/the-us-militarys-gps-software-is-an-8-billion-mess/,"The GPS Next-Generation Operational Control System was due for completion in 2016. Ten years later, the software for controlling the military’s GPS satellites still doesn’t work.","STEPHEN CLARK, ARS TECHNICA",2026-04-21T08:50:24.200717,Wired.com
The Broken System That Keeps Shipping Crews Stranded in the Strait of Hormuz,https://www.wired.com/story/legal-loopholes-leave-shipping-crews-stranded-in-the-strait-of-hormuz/,"Vessels are increasingly being abandoned during the war on Iran, revealing a hidden failure in the global systems that keep goods—and people—moving.",RUCHI KUMAR,2026-04-21T08:50:25.962802,Wired.com
Security News This Week: Iranian Hackers Breached Kash Patel’s Email—but Not the FBI’s,https://www.wired.com/story/iranian-hackers-breached-the-fbi-directors-personal-email-but-not-the-fbi/,"Plus: Apple makes big claims about the effectiveness of its Lockdown Mode anti-spyware feature, Russia moves to implement homegrown encryption for 5G, and more.",ANDY GREENBERG,2026-04-21T08:50:27.223696,Wired.com
How Trump’s Plot to Grab Iran's Nuclear Fuel Would Actually Work,https://www.wired.com/story/us-iran-war-nuclear-extraction-ground-operation/,"Experts say that an American ground operation targeting nuclear sites in Iran would be incredibly complicated, put troops’ lives at great risk—and might still fail.",CAROLINE HASKINS,2026-04-21T08:50:28.456830,Wired.com
A $20 Billion Crypto Scam Market Faces a New Government Crackdown,https://www.wired.com/story/20-billion-xinbi-guarantee-uk-sanctions/,The Telegram-based Xinbi Guarantee black market sells services that help prop up scam operations. British officials just hit the highly lucrative marketplace with sweeping sanctions.,MATT BURGESS,2026-04-21T08:50:29.557163,Wired.com
Using a VPN May Subject You to NSA Spying,https://www.wired.com/story/using-a-vpn-may-subject-you-to-nsa-spying/,US lawmakers are pressing Tulsi Gabbard to reveal whether using a VPN can strip Americans of their constitutional protections against warrantless surveillance.,DELL CAMERON,2026-04-21T08:50:30.801607,Wired.com
"Anduril Wants to Own the Future of War Tech. Mishaps, Delays, and Challenges Abound",https://www.wired.com/story/andurils-real-war-is-with-itself/,"From drones to missiles to submarines, the $30.5 billion defense startup wants to transform how the tools of war are made. It’s not all going as planned.",PARESH DAVE,2026-04-21T08:50:31.878440,Wired.com
There’s New Evidence for How Loneliness Affects Memory in Old Age,https://www.wired.com/story/theres-new-evidence-for-how-loneliness-affects-memory-in-old-age/,A longitudinal study found that loneliness is more closely linked to lapses in immediate and delayed recall than to the overall speed of cognitive decline.,JORGE GARAY,2026-04-21T08:50:33.177774,Wired.com
The ‘Lonely Runner’ Problem Only Appears Simple,https://www.wired.com/story/the-lonely-runner-problem-only-appears-simple/,"Take a group of runners circling a track at unique, constant paces. Answering the question of how many will always end up running alone, no matter their speed, has vexed mathematicians for decades.",PAULINA ROWIŃSKA,2026-04-21T08:50:34.704637,Wired.com
How Can Astronauts Tell How Fast They’re Going?,https://www.wired.com/story/how-can-astronauts-tell-how-fast-theyre-going/,"Weirdly, spaceships have no direct way to gauge their own speed. Luckily, we can use some physics tricks to figure it out.",RHETT ALLAIN,2026-04-21T08:50:36.095209,Wired.com
Flight Path Data Shows How Mosquitoes Target Humans,https://www.wired.com/story/flight-path-data-shows-how-mosquitoes-target-humans/,"Scientists have quantified what draws mosquitoes to people—which could help make better, life-saving bug traps.",RITSUKO KAWAI,2026-04-21T08:50:37.016447,Wired.com
Scientists Have Made a French Fry Breakthrough,https://www.wired.com/story/scientists-have-made-french-fry-breakthrough/,Researchers have developed a method of making french fries that results in a healthier bite without sacrificing crispiness.,MARTA MUSSO,2026-04-21T08:50:38.596114,Wired.com
FDA Approves Eli Lilly’s GLP-1 Pill,https://www.wired.com/story/fda-approves-eli-lillys-glp-1-pill/,Eli Lilly’s once-daily Foundayo is the second obesity pill to receive FDA approval. It will compete with Novo Nordisk’s pill version of Wegovy.,EMILY MULLIN,2026-04-21T08:50:40.101243,Wired.com
"6,000 Meters Under the Pacific, Japan Seeks Independence From China on Rare Earths",https://www.wired.com/story/under-the-pacific-japan-seeks-independence-from-china-on-rare-earths/,"Tokyo is succeeding where the rest of the world has failed, reducing its reliance on Beijing for crucial rare earth elements—thanks to an enormous underwater deposit discovered on a remote island.",LORENZO LAMPERTI,2026-04-21T08:50:41.605185,Wired.com
Marine Animals in the Strait of Hormuz Don’t Get a Ceasefire,https://www.wired.com/story/marine-animals-in-the-strait-of-hormuz-dont-get-a-ceasefire/,"As ships return to the Strait of Hormuz, mines, sonar, and congestion continue to reshape the Gulf beneath the surface.",EVANGELINE ELSA,2026-04-21T08:50:42.901512,Wired.com
Trump’s War on Iran Could Screw Over US Farmers,https://www.wired.com/story/trumps-war-on-iran-could-screw-over-us-farmers/,The Middle East supplies a huge amount of the world’s fertilizer. Conflict in the region has sent prices soaring ahead of the critical spring planting season.,MOLLY TAFT,2026-04-21T08:50:44.185727,Wired.com
The Last Mystery of Antarctica’s ‘Blood Falls’ Has Finally Been Solved,https://www.wired.com/story/the-last-mystery-of-antarcticas-blood-falls-has-finally-been-solved/,New research sheds light on what drives reddish water to emerge from underground to pour onto the Taylor Glacier.,SIMONE VALESINI,2026-04-21T08:50:45.303184,Wired.com
The US Government Will Ask Data Centers How Much Power They Use,https://www.wired.com/story/the-us-government-to-ask-data-centers-how-much-power-they-use/,"In a letter obtained by WIRED, the Energy Information Administration tells two senators that it plans to develop a mandatory assessment of data centers' energy use.",MOLLY TAFT,2026-04-21T08:50:46.633294,Wired.com
There’s a Secret Ingredient to Making Luxury Ice at Home,https://www.wired.com/story/secret-ingredient-to-making-luxury-ice-at-home/,"Nice ice is big business, but you can get perfectly clear cubes at home without freezing your assets.",JEREMY WHITE,2026-04-21T08:50:48.151504,Wired.com
A Single Strike Won’t Shut Off the Gulf’s Desalination System,https://www.wired.com/story/a-single-strike-wont-shut-off-the-gulfs-desalination-system/,"The Gulf’s water system is built with layers of backup, but it relies on continuous operation to hold.",DANA ALOMAR,2026-04-21T08:50:49.366366,Wired.com
A New Google-Funded Data Center Will Be Powered by a Massive Gas Plant,https://www.wired.com/story/a-new-google-funded-data-center-will-be-powered-by-a-massive-gas-plant/,Documents show that one of Google’s new data centers would be powered by a natural gas plant that emits millions of tons of emissions each year—an increasingly common trend in the industry.,MOLLY TAFT,2026-04-21T08:50:50.605845,Wired.com
"One Way or Another, Most of Our Electricity Comes From Solar Power",https://www.wired.com/story/most-of-our-electricity-comes-from-solar-power/,"That’s good news, since the forecast is sunshine for the next 5 billion years.",RHETT ALLAIN,2026-04-21T08:50:51.930674,Wired.com
Senators Demand to Know How Much Energy Data Centers Use,https://www.wired.com/story/senators-demand-to-know-how-much-energy-data-centers-use/,"In a letter sent Thursday morning, Elizabeth Warren and Josh Hawley press the Energy Information Agency to mandate annual electricity disclosure for data centers.",MOLLY TAFT,2026-04-21T08:50:53.145098,Wired.com
The AI Race Is Pressuring Utilities to Squeeze More From Europe’s Power Grids,https://www.wired.com/story/europe-squeeze-power-energy-grid-ai-data-center/,"As data center developers queue up to connect to power grids across Europe, network operators are experimenting with novel ways of clearing room for them.",JOEL KHALILI,2026-04-21T08:50:54.371287,Wired.com
Iran War Puts Global Energy Markets on the Brink of a Worst-Case Scenario,https://www.wired.com/story/iran-war-puts-global-energy-markets-on-the-brink-of-a-worst-case-scenario/,"“This will be so, so, so, so, so bad,” one analyst says.",MOLLY TAFT,2026-04-21T08:50:55.678280,Wired.com
NASA Wants to Put Nuclear Reactors on the Moon,https://www.wired.com/story/nasa-wants-to-put-nuclear-reactors-on-the-moon/,The White House has announced that NASA will work with the Departments of Defense and Energy to put nuclear reactors in orbit and on the surface of the moon.,JORGE GARAY,2026-04-21T08:50:57.152514,Wired.com
"The Caves That Could Help Us Find, or Become, Aliens",https://www.wired.com/story/the-caves-that-could-help-us-find-or-become-aliens/,"From lava tubes on Mars to ice pockets on Europa, subterranean environments may offer the best chance of finding life—and living safely—beyond our planet.",BECKY FERREIRA,2026-04-21T08:50:58.377263,Wired.com
Artemis II Astronauts Return Safely to Earth After Historic Flight Around the Moon,https://www.wired.com/story/artemis-ii-returns-from-historic-flight-around-the-moon/,"After traveling a greater distance from Earth than any humans before them, the astronauts of Artemis II have safely returned home.",JAY BENNETT,2026-04-21T08:50:59.609449,Wired.com
The Future of the Artemis Program Is Riding on Reentry,https://www.wired.com/story/the-future-of-the-artemis-program-is-riding-on-reentry/,"Entire space programs have been canceled after a failure in the reentry phase. In the final test for Artemis II, astronauts will travel at 32 times the speed of sound as they return from the moon.",JORGE GARAY,2026-04-21T08:51:00.836192,Wired.com
A Quantum Leap for the Turing Award,https://www.wired.com/story/a-quantum-leap-for-the-turing-award/,Charles Bennett and Gilles Brassard pioneered quantum information theory. Now they've been awarded the highest honor in computer science.,STEVEN LEVY,2026-04-21T08:51:02.567087,Wired.com
You Can Approximate Pi by Dropping Needles on the Floor,https://www.wired.com/story/you-can-approximate-pi-by-dropping-needles-on-the-floor/,Who needs a supercomputer when you can calculate pi with a box of sewing needles?,RHETT ALLAIN,2026-04-21T08:51:03.942387,Wired.com
How Can a Locomotive Pull a Long Train That’s Much Heavier?,https://www.wired.com/story/how-can-a-locomotive-pull-a-train-thats-much-heavier/,"For railroads, it’s all about managing static and kinetic friction.",RHETT ALLAIN,2026-04-21T08:51:05.415176,Wired.com
Could AI Data Centers Be Moved to Outer Space?,https://www.wired.com/story/could-we-put-ai-data-centers-in-space/,Massive data centers for generative AI are bad for the Earth. How about launching them into orbit?,RHETT ALLAIN,2026-04-21T08:51:07.018313,Wired.com
This Beanie Is Designed to Read Your Thoughts,https://www.wired.com/story/this-beanie-is-designed-to-read-your-thoughts/,California-based startup Sabi is developing a thought-to-text wearable that could usher in the cyborg future.,EMILY MULLIN,2026-04-21T08:51:08.499396,Wired.com
A New Implant Aims to Rewire the Brain to Help Stroke Patients,https://www.wired.com/story/a-new-implant-aims-to-rewire-the-brain-to-help-stroke-patients/,Epia Neuro’s brain-computer interface will include a motorized glove to help stroke patients recover movement in their hand.,EMILY MULLIN,2026-04-21T08:51:09.935010,Wired.com
Meet the Man Making Music With His Brain Implant,https://www.wired.com/story/meet-the-man-making-music-with-his-brain-implant/,Galen Buckwalter says brain-computer interfaces will have to be enjoyable to use if the technology is going to be successful.,EMILY MULLIN,2026-04-21T08:51:10.956619,Wired.com
A Billionaire-Backed Startup Wants to Grow 'Organ Sacks' to Replace Animal Testing,https://www.wired.com/story/a-billionaire-backed-startup-wants-to-grow-organ-sacks-to-replace-animal-testing/,"R3 Bio has a bold idea for replacing lab animals: genetically-engineered whole organ systems that lack a brain. The long-term goal, says a cofounder, is to make human versions.",EMILY MULLIN,2026-04-21T08:51:11.934601,Wired.com
Study of Buddhist Monks Finds Meditation Alters Brain Activity,https://www.wired.com/story/study-of-buddhist-monks-finds-meditation-alters-brain-activity/,"Meditation isn’t thinking about nothing. New research reinforces that it’s a mind-altering, dynamic state that promotes focus, learning, and well-being.",JAVIER CARBAJAL,2026-04-21T08:51:13.324376,Wired.com
Neuroscientists Decipher Procrastination: A Brain Mechanism Explains Why People Leave Certain Tasks for Later,https://www.wired.com/story/neuroscience-procrastination-brain-mechanism-task-avoidance/,New research has discovered that a neural circuit may explain procrastination. Scientists were able to disrupt this connection using a drug.,FERNANDA GONZÁLEZ,2026-04-21T08:51:14.422112,Wired.com
Brain Gear Is the Hot New Wearable,https://www.wired.com/story/expired-tired-wired-wearables/,"Smartwatches are cool and all, but have you considered wearable neurotech?",EMILY MULLIN,2026-04-21T08:51:15.613384,Wired.com
